acadm_year	acadm_term	authorize_p	authorize_using	chn_name	classes	comment	counter	counter_exceptAuth	course_avg	course_code	course_group	course_kind	credit	dept_chiabbr	dept_code	dept_group_name	eng_name	eng_teach	form_s	limit	limit_count_h	option_code	restrict	rt	serial_no	teacher	time_inf	generalCore
114	1	3	0	雙語教材教法（教） </br>[ 學分學程：國際教師學程-數學 國際教師學程-物理 國際教師學程-國際 ]			0	0		00UEB01	C	半	2.0	師培學院	EU		Teaching Materials and Methods : Bilingual Education </br>[ Program: The Program of International Baccalaureate Educator Certificate-International  Mathematics Education The Program of International Baccalaureate Educator Certificate-International  Physics  Education The Program of International Baccalaureate Educator Certificate-International Education ]			0	45	必	◎限 雙語修習資格生 可修	N	0622	王力億	五 3-4 和平 誠106	
114	1	10	0	雙語教學應用與實作（教） </br>[ 學分學程：國際教師學程-數學 國際教師學程-物理 國際教師學程-國際 ]			0	0		00UEB02	A	半	1.0	師培學院	EU		Practice in Bilingual Teaching </br>[ Program: The Program of International Baccalaureate Educator Certificate-International  Mathematics Education The Program of International Baccalaureate Educator Certificate-International  Physics  Education The Program of International Baccalaureate Educator Certificate-International Education ]	是		0	50	必	◎限 雙語修習資格生 可修	N	0623	柯琦	一 3 和平 樸401	
114	1	10	0	雙語教學應用與實作（教） </br>[ 學分學程：國際教師學程-數學 國際教師學程-物理 國際教師學程-國際 ]			0	0		00UEB02	B	半	1.0	師培學院	EU		Practice in Bilingual Teaching </br>[ Program: The Program of International Baccalaureate Educator Certificate-International  Mathematics Education The Program of International Baccalaureate Educator Certificate-International  Physics  Education The Program of International Baccalaureate Educator Certificate-International Education ]	是		0	50	必	◎限 雙語修習資格生 可修	N	0624	柯琦	二 3 和平 樸401	
114	1	10	0	雙語教學應用與實作（教） </br>[ 學分學程：國際教師學程-數學 國際教師學程-物理 國際教師學程-國際 ]			0	0		00UEB02	C	半	1.0	師培學院	EU		Practice in Bilingual Teaching </br>[ Program: The Program of International Baccalaureate Educator Certificate-International  Mathematics Education The Program of International Baccalaureate Educator Certificate-International  Physics  Education The Program of International Baccalaureate Educator Certificate-International Education ]	是		0	50	必	◎限 雙語修習資格生 可修	N	0625	柯琦	五 3 和平 樸301	
114	1	10	0	雙語教育概論（教） </br>[ 學分學程：國際教師學程-數學 國際教師學程-物理 國際教師學程-國際 ]			0	0		00UEB03	A	半	2.0	師培學院	EU		Introduction to Bilingual Education </br>[ Program: The Program of International Baccalaureate Educator Certificate-International  Mathematics Education The Program of International Baccalaureate Educator Certificate-International  Physics  Education The Program of International Baccalaureate Educator Certificate-International Education ]	是		0	50	必	◎限 雙語修習資格生 可修	N	0626	柯琦	二 1-2 和平 樸401	
114	1	10	0	雙語教育概論（教） </br>[ 學分學程：國際教師學程-數學 國際教師學程-物理 國際教師學程-國際 ]			0	0		00UEB03	B	半	2.0	師培學院	EU		Introduction to Bilingual Education </br>[ Program: The Program of International Baccalaureate Educator Certificate-International  Mathematics Education The Program of International Baccalaureate Educator Certificate-International  Physics  Education The Program of International Baccalaureate Educator Certificate-International Education ]	是		0	50	必	◎限 雙語修習資格生 可修	N	0627	柯琦	四 1-2 和平 樸301	
114	1	10	0	雙語教學實習（教） </br>[ 學分學程：國際教師學程-數學 國際教師學程-物理 國際教師學程-國際 ]			0	0		00UEB04	A	半	2.0	師培學院	EU		Teaching Practicum: Bilingual Education </br>[ Program: The Program of International Baccalaureate Educator Certificate-International  Mathematics Education The Program of International Baccalaureate Educator Certificate-International  Physics  Education The Program of International Baccalaureate Educator Certificate-International Education ]			0	50	必	◎限 雙語修習資格生 可修 ◎必須先修過(也可以同時修)【00UEB01  雙語教材教法（教）】	N	0628	程峻	二 10-A 和平 誠301	
114	1	10	0	雙語教學實習（教） </br>[ 學分學程：國際教師學程-數學 國際教師學程-物理 國際教師學程-國際 ]		此課程有入國中現場觀課或試教的需要。	0	0		00UEB04	B	半	2.0	師培學院	EU		Teaching Practicum: Bilingual Education </br>[ Program: The Program of International Baccalaureate Educator Certificate-International  Mathematics Education The Program of International Baccalaureate Educator Certificate-International  Physics  Education The Program of International Baccalaureate Educator Certificate-International Education ]			0	50	必	◎限 雙語修習資格生 可修 ◎必須先修過(也可以同時修)【00UEB01  雙語教材教法（教）】	N	0629	陳凱俐	三 10-A 和平 誠204	
114	1	10	0	雙語教育之課室英語（教） </br>[ 學分學程：國際教師學程-數學 國際教師學程-物理 國際教師學程-國際 ]			0	0		00UEB06		半	3.0	師培學院	EU		Classroom English for Bilingual Education </br>[ Program: The Program of International Baccalaureate Educator Certificate-International  Mathematics Education The Program of International Baccalaureate Educator Certificate-International  Physics  Education The Program of International Baccalaureate Educator Certificate-International Education ]	是		0	50	選	◎限 雙語修習資格生 可修	N	0630	柯琦	四 6-8 和平 樸401	
114	1	10	0	特殊教育教學實習（一）（資優） </br>[ 學分學程：國際教師學程-華語文 國際教師學程-數學 國際教師學程-物理 國際教師學程-國際 ]			0	0		00UEG01	A	半	2.0	師培學院	EU		Practicum in Teaching Students with Special Needs (I) </br>[ Program: The Program of International Baccalaureate Educator Certificate-Chinese Language Education The Program of International Baccalaureate Educator Certificate-International  Mathematics Education The Program of International Baccalaureate Educator Certificate-International  Physics  Education The Program of International Baccalaureate Educator Certificate-International Education ]			0	30	必	◎限 不佔名額生 資優教育學程生 可修◎必須先修過【00UEG03  資賦優異學生教材教法（一）（資優）】◎必須先修過(也可以同時修)【00UEG04  資賦優異學生教材教法（二）（資優）】	N	0631	陳偉仁	四 6-9 和平 特103	
114	1	6	0	特殊教育教學實習（一）（資優） </br>[ 學分學程：國際教師學程-華語文 國際教師學程-數學 國際教師學程-物理 國際教師學程-國際 ]			0	0		00UEG01	B	半	2.0	師培學院	EU		Practicum in Teaching Students with Special Needs (I) </br>[ Program: The Program of International Baccalaureate Educator Certificate-Chinese Language Education The Program of International Baccalaureate Educator Certificate-International  Mathematics Education The Program of International Baccalaureate Educator Certificate-International  Physics  Education The Program of International Baccalaureate Educator Certificate-International Education ]			0	30	必	◎限 不佔名額生 資優教育學程生 可修◎必須先修過【00UEG03  資賦優異學生教材教法（一）（資優）】◎必須先修過(也可以同時修)【00UEG04  資賦優異學生教材教法（二）（資優）】	N	0632	鄒小蘭	四 6-9 和平 特116	
114	1	10	0	資賦優異學生教材教法（二）（資優） </br>[ 學分學程：國際教師學程-華語文 國際教師學程-數學 國際教師學程-物理 國際教師學程-國際 ]			0	0		00UEG04		半	2.0	師培學院	EU		Curriculum and Instructional Designs for Gifted and Talented Students (II) </br>[ Program: The Program of International Baccalaureate Educator Certificate-Chinese Language Education The Program of International Baccalaureate Educator Certificate-International  Mathematics Education The Program of International Baccalaureate Educator Certificate-International  Physics  Education The Program of International Baccalaureate Educator Certificate-International Education ]			0	30	必	◎限 不佔名額生 資優教育學程生 可修	N	0633	陳偉仁	二 10-A 和平 特113	
114	1	10	0	創造力教育（資優） </br>[ 學分學程：國際教師學程-華語文 國際教師學程-數學 國際教師學程-物理 國際教師學程-國際 ]			0	0		00UEG07	A	半	2.0	師培學院	EU		Creativity </br>[ Program: The Program of International Baccalaureate Educator Certificate-Chinese Language Education The Program of International Baccalaureate Educator Certificate-International  Mathematics Education The Program of International Baccalaureate Educator Certificate-International  Physics  Education The Program of International Baccalaureate Educator Certificate-International Education ]			0	25	必	◎限 不佔名額生 資優教育學程生 可修	N	0634	潘裕豐	三 8-9 和平 特114視聽室	
114	1	10	0	領導才能教育（資優） </br>[ 學分學程：國際教師學程-華語文 國際教師學程-數學 國際教師學程-物理 國際教師學程-國際 ]			0	0		00UEG08		半	2.0	師培學院	EU		Leadership Education </br>[ Program: The Program of International Baccalaureate Educator Certificate-Chinese Language Education The Program of International Baccalaureate Educator Certificate-International  Mathematics Education The Program of International Baccalaureate Educator Certificate-International  Physics  Education The Program of International Baccalaureate Educator Certificate-International Education ]			0	25	必	◎限 不佔名額生 資優教育學程生 可修	N	0635	潘裕豐	二 6-7 和平 特113	
114	1	10	0	資優教育專題研究（資優） </br>[ 學分學程：國際教師學程-華語文 國際教師學程-數學 國際教師學程-物理 國際教師學程-國際 ]			0	0		00UEG10		半	2.0	師培學院	EU		Special Topics on Gifted and Talented Education </br>[ Program: The Program of International Baccalaureate Educator Certificate-Chinese Language Education The Program of International Baccalaureate Educator Certificate-International  Mathematics Education The Program of International Baccalaureate Educator Certificate-International  Physics  Education The Program of International Baccalaureate Educator Certificate-International Education ]			0	25	必	◎限 不佔名額生 資優教育學程生 可修	N	0636	李家兆	一 A-B 和平 特115	
114	1	10	0	資源教室方案與經營（資優） </br>[ 學分學程：國際教師學程-華語文 國際教師學程-數學 國際教師學程-物理 國際教師學程-國際 ]			0	0		00UEG16		半	2.0	師培學院	EU		Introduction and Management of Resource Room Programs </br>[ Program: The Program of International Baccalaureate Educator Certificate-Chinese Language Education The Program of International Baccalaureate Educator Certificate-International  Mathematics Education The Program of International Baccalaureate Educator Certificate-International  Physics  Education The Program of International Baccalaureate Educator Certificate-International Education ]			0	5	必	◎限 不佔名額生 資優教育學程生 可修	N	0637	劉秀丹 吳冠穎	四 1-2 和平 特114視聽室	
114	1	10	0	特殊教育行政與法規（資優） </br>[ 學分學程：國際教師學程-華語文 國際教師學程-數學 國際教師學程-物理 國際教師學程-國際 ]			0	0		00UEG17	A	半	2.0	師培學院	EU		Special Education Administration and Related Laws </br>[ Program: The Program of International Baccalaureate Educator Certificate-Chinese Language Education The Program of International Baccalaureate Educator Certificate-International  Mathematics Education The Program of International Baccalaureate Educator Certificate-International  Physics  Education The Program of International Baccalaureate Educator Certificate-International Education ]			0	10	必	◎限 不佔名額生 資優教育學程生 可修	N	0638	邱春瑜	二 1-2 和平 特115	
114	1	10	0	特殊教育行政與法規（資優） </br>[ 學分學程：國際教師學程-華語文 國際教師學程-數學 國際教師學程-物理 國際教師學程-國際 ]			0	0		00UEG17	B	半	2.0	師培學院	EU		Special Education Administration and Related Laws </br>[ Program: The Program of International Baccalaureate Educator Certificate-Chinese Language Education The Program of International Baccalaureate Educator Certificate-International  Mathematics Education The Program of International Baccalaureate Educator Certificate-International  Physics  Education The Program of International Baccalaureate Educator Certificate-International Education ]			0	40	必	◎限 不佔名額生 資優教育學程生 可修	N	0639	趙本強	四 3-4 和平 特112	
114	1	10	0	資優教育概論（資優） </br>[ 學分學程：國際教師學程-華語文 國際教師學程-數學 國際教師學程-物理 國際教師學程-國際 ]			0	0		00UEG18		半	2.0	師培學院	EU		Introduction to Education for the Gifted </br>[ Program: The Program of International Baccalaureate Educator Certificate-Chinese Language Education The Program of International Baccalaureate Educator Certificate-International  Mathematics Education The Program of International Baccalaureate Educator Certificate-International  Physics  Education The Program of International Baccalaureate Educator Certificate-International Education ]			0	40	必	◎限 不佔名額生 資優教育學程生 可修	N	0640	李家兆	二 A-B 和平 特115	
114	1	5	0	特殊教育導論（資優） </br>[ 學分學程：國際教師學程-華語文 國際教師學程-數學 國際教師學程-物理 國際教師學程-國際 ]			0	0		00UEG19	A	半	3.0	師培學院	EU		Introduction to Special Education </br>[ Program: The Program of International Baccalaureate Educator Certificate-Chinese Language Education The Program of International Baccalaureate Educator Certificate-International  Mathematics Education The Program of International Baccalaureate Educator Certificate-International  Physics  Education The Program of International Baccalaureate Educator Certificate-International Education ]			0	10	必	◎限 不佔名額生 資優教育學程生 可修	N	0641	張素貞 朱怡珊	四 10-B 和平 誠202	
114	1	10	0	特殊教育導論（資優） </br>[ 學分學程：國際教師學程-華語文 國際教師學程-數學 國際教師學程-物理 國際教師學程-國際 ]			0	0		00UEG19	B	半	3.0	師培學院	EU		Introduction to Special Education </br>[ Program: The Program of International Baccalaureate Educator Certificate-Chinese Language Education The Program of International Baccalaureate Educator Certificate-International  Mathematics Education The Program of International Baccalaureate Educator Certificate-International  Physics  Education The Program of International Baccalaureate Educator Certificate-International Education ]	是		0	50	必	◎限 不佔名額生 資優教育學程生 可修	N	0642	王宣惠	四 2-4 和平 特103	
114	1	5	0	特殊教育導論（資優） </br>[ 學分學程：國際教師學程-華語文 國際教師學程-數學 國際教師學程-物理 國際教師學程-國際 ]			0	0		00UEG19	C	半	3.0	師培學院	EU		Introduction to Special Education </br>[ Program: The Program of International Baccalaureate Educator Certificate-Chinese Language Education The Program of International Baccalaureate Educator Certificate-International  Mathematics Education The Program of International Baccalaureate Educator Certificate-International  Physics  Education The Program of International Baccalaureate Educator Certificate-International Education ]			0	5	必	◎限 不佔名額生 資優教育學程生 可修	N	0643	林淑莉	二 6-8 和平 特103	
114	1	10	0	科學資優教育（資優） </br>[ 學分學程：國際教師學程-華語文 國際教師學程-數學 國際教師學程-物理 國際教師學程-國際 ]			0	0		00UEG20		半	2.0	師培學院	EU		Gifted and Talented Education for Science </br>[ Program: The Program of International Baccalaureate Educator Certificate-Chinese Language Education The Program of International Baccalaureate Educator Certificate-International  Mathematics Education The Program of International Baccalaureate Educator Certificate-International  Physics  Education The Program of International Baccalaureate Educator Certificate-International Education ]			0	25	選	◎限 不佔名額生 資優教育學程生 可修	N	0644	傅祖怡	一 8-9 和平 特116	
114	1	10	0	藝術資優教育（資優） </br>[ 學分學程：國際教師學程-華語文 國際教師學程-數學 國際教師學程-物理 國際教師學程-國際 ]			0	0		00UEG22		半	2.0	師培學院	EU		Gifted and Talented Education for Arts </br>[ Program: The Program of International Baccalaureate Educator Certificate-Chinese Language Education The Program of International Baccalaureate Educator Certificate-International  Mathematics Education The Program of International Baccalaureate Educator Certificate-International  Physics  Education The Program of International Baccalaureate Educator Certificate-International Education ]			0	25	選	◎限 不佔名額生 資優教育學程生 可修	N	0645	吳舜文	四 A-B 和平 特115	
114	1	10	0	議題融入資優教育教學設計（資優） </br>[ 學分學程：國際教師學程-華語文 國際教師學程-數學 國際教師學程-物理 國際教師學程-國際 ]			0	0		00UEG24		半	2.0	師培學院	EU		The Teaching Design of the Issues Integrated into Gifted Education </br>[ Program: The Program of International Baccalaureate Educator Certificate-Chinese Language Education The Program of International Baccalaureate Educator Certificate-International  Mathematics Education The Program of International Baccalaureate Educator Certificate-International  Physics  Education The Program of International Baccalaureate Educator Certificate-International Education ]			0	25	選	◎限 不佔名額生 資優教育學程生 可修	N	0646	陳偉仁	三 6-7 和平 特113	
114	1	10	0	資賦優異教學實務（資優） </br>[ 學分學程：國際教師學程-華語文 國際教師學程-數學 國際教師學程-物理 國際教師學程-國際 ]			0	0		00UEG25		半	2.0	師培學院	EU		Practicum in Gifted and Talented Education </br>[ Program: The Program of International Baccalaureate Educator Certificate-Chinese Language Education The Program of International Baccalaureate Educator Certificate-International  Mathematics Education The Program of International Baccalaureate Educator Certificate-International  Physics  Education The Program of International Baccalaureate Educator Certificate-International Education ]			0	20	選	◎限 不佔名額生 資優教育學程生 可修 ◎必須先修過(也可以同時修)【00UEG04  資賦優異學生教材教法（二）（資優）】	N	0647	進明	三 10-A 和平 特116	
114	1	10	-26	IB哲學與實作（IB） </br>[ 學分學程：國際教師學程-華語文 國際教師學程-數學 國際教師學程-物理 國際教師學程-國際 ]	9	本課程要求第一堂課須到課始發放授權碼	0	26		IBC9004		半	3.0	師培學院	EU		IB Philosophy and Practices(IB) </br>[ Program: The Program of International Baccalaureate Educator Certificate-Chinese Language Education The Program of International Baccalaureate Educator Certificate-International  Mathematics Education The Program of International Baccalaureate Educator Certificate-International  Physics  Education The Program of International Baccalaureate Educator Certificate-International Education ]	是		0	30	選	◎初選 國際教師學程-華語文 國際教師學程-數學 國際教師學程-物理 國際教師學程-國際 研究生得下修◎限國際教師學程-華語文、國際教師學程-數學、國際教師學程-物理、國際教師學程-國際選修 ◎加退選全授權碼選課	N	0648	劉美慧	二 6-8 和平 樸106	
114	1	3	-23	課程發展與設計（IB） </br>[ 學分學程：國際教師學程-國際 ]	9	本課程要求第一堂課須到課始發放授權碼	0	23		IBC9007		半	3.0	師培學院	EU		Curriculum Development and Design (IB) </br>[ Program: The Program of International Baccalaureate Educator Certificate-International Education ]	是		0	45	選	◎初選 國際教師學程-華語文 國際教師學程-數學 國際教師學程-物理 國際教師學程-國際 研究生得下修◎限國際教師學程-華語文、國際教師學程-數學、國際教師學程-物理、國際教師學程-國際選修	N	0649	葉怡芬	三 6-8 和平 誠106	
114	1	10	0	邏輯			0	0		EDU0011		半	2.0	教育系（學）	EU00		Logic		1	0	50	選	◎限大一修習	N	0650	崔	四 9-10 和平 教312	
114	1	10	0	發展心理學			0	0		EDU0015		半	2.0	教育系（學）	EU00		Developmental Psychology		1	0	50	選	◎限大一修習	N	0651	唐淑華	一 8-9 和平 教9樓綜合教室	
114	1	10	-1	社會學 </br>[ 學分學程：人社學程 ]			0	1		EDU0075		半	2.0	教育系（學）	EU00		Sociology </br>[ Program: Human Services and Social Work Credit Program ]		1	0	50	選	◎限大一修習	N	0652	張宜君	三 8-9 和平 教312	
114	1	10	-1	教育概論			2	3		EDU0153	A	半	2.0	教育系（學）	EU00		Introduction to Education	是	1	1	50	必	◎限大一大二修習◎限教育系（學）（含雙主修、輔系）、教院學士班（學）選修	N	0653	鄭英傑	二 6-7 和平 教315	
114	1	10	0	教育概論		本班採中文授課	1	1		EDU0153	B	半	2.0	教育系（學）	EU00		Introduction to Education		1	1	50	必	◎限本系(含雙主修)、輔系修習◎限大一◎限甲班乙班修習	N	0654	葉坤靈	三 6-7 和平 教9樓綜合教室	
114	1	10	-1	教育心理學 </br>[ 學分學程：PASSION偏鄉教育學程 ]			0	1		EDU0154	A	半	2.0	教育系（學）	EU00		Educational Psychology </br>[ Program: The Program of PASSION Quality Education in Rural Schools ]	是	1	1	50	必	◎限大一大二修習◎限教育系（學）（含雙主修、輔系）、教院學士班（學）選修	N	0655	唐淑華	二 8-9 和平 教310	
114	1	10	0	教育心理學 </br>[ 學分學程：PASSION偏鄉教育學程 ]		本班採中文授課	0	0		EDU0154	B	半	2.0	教育系（學）	EU00		Educational Psychology </br>[ Program: The Program of PASSION Quality Education in Rural Schools ]		1	1	50	必	◎限本系(含雙主修)、輔系修習◎限大一大二◎限甲班乙班修習	N	0656	唐淑華	二 3-4 和平 教9樓綜合教室	
114	1	10	0	中國教育史	1		4	4		EDU0003		半	2.0	教育系（學）	EU00		History of Chinese Education		1	1	50	必	◎限本系(含雙主修)、輔系修習◎限大一◎限甲班修習	N	0657	周愚文	一 6-7 和平 教802	
114	1	10	0	中國教育史	2		1	1		EDU0003		半	2.0	教育系（學）	EU00		History of Chinese Education		1	1	50	必	◎限本系(含雙主修)、輔系修習◎限大一◎限乙班修習	N	0658	周愚文	一 3-4 和平 教802	
114	1	10	-59	教育政治學			0	59		EDU0021		半	2.0	教育系（學）	EU00		Politics of Education		2	0	50	選		N	0659	王麗雲	二 8-9 和平 教312	
114	1	10	-59	美育原理 </br>[ 學分學程：社團領導學程 ]			0	59		EDU0022		半	2.0	教育系（學）	EU00		Theories of Aesthetic Education </br>[ Program: The Program of Club Members Leadership And Empowerment Cultivation ]		2	0	50	選		N	0660	林逢祺	二 6-7 和平 教802	
114	1	10	-71	教育法令			0	71		EDU0034		半	2.0	教育系（學）	EU00		Laws of School		2	0	50	選		N	0661	陳宏彰	三 6-7 和平 教315	
114	1	10	-54	學習理論			0	54		EDU0117		半	2.0	教育系（學）	EU00		Theories of Learning		2	0	50	選		N	0662	王力億	四 3-4 和平 教802	
114	1	10	-26	西洋哲學史（一）			0	26		EDU0205		半	2.0	教育系（學）	EU00		History of Western Philosophy(I)		2	0	50	選		N	0663	崔	五 1-2 和平 教312	
114	1	10	-30	教育行政 </br>[ 學分學程：社團領導學程 ]	1		3	33		EDU0005		半	2.0	教育系（學）	EU00		Educational Administration </br>[ Program: The Program of Club Members Leadership And Empowerment Cultivation ]		2	1	50	必	◎限本系(含雙主修)、輔系修習◎限大二◎限甲班修習◎必須先修過【EDU0153  教育概論】	N	0664	黃乃熒	四 6-7 和平 教315	
114	1	10	-32	教育社會學	1		1	33		EDU0156		半	2.0	教育系（學）	EU00		Sociology of Education		2	1	50	必	◎限本系(含雙主修)、輔系修習◎限大二◎限甲班修習	N	0665	鄭英傑	二 3-4 和平 教310	
114	1	10	-32	課程原理 </br>[ 學分學程：科技化教學產業學程 ]	1		3	35		EDU0184		半	2.0	教育系（學）	EU00		Theories of Curriculum </br>[ Program: The Program of Technology-assisted Teaching Industry ]		2	1	50	必	◎限本系(含雙主修)、輔系修習◎限大二◎限甲班修習	N	0666	卯靜儒	四 8-9 和平 教802	
114	1	10	-26	教育行政 </br>[ 學分學程：社團領導學程 ]	2		1	27		EDU0005		半	2.0	教育系（學）	EU00		Educational Administration </br>[ Program: The Program of Club Members Leadership And Empowerment Cultivation ]		2	1	50	必	◎限本系(含雙主修)、輔系修習◎限大二◎限乙班修習◎必須先修過【EDU0153  教育概論】	N	0667	陳玉娟	四 1-2 和平 教315	
